<?xml version="1.0" encoding="UTF-8"?>
<xs:schema xmlns:xs="http://www.w3.org/2001/XMLSchema" targetNamespace="https://github.com/fwiep/trekisode" xmlns:t="https://github.com/fwiep/trekisode" elementFormDefault="qualified">

  <xs:element name="StarTrek" type="t:TypeStarTrek">
    <xs:unique name="uniqueSeries">
      <xs:selector xpath="t:Series" />
      <xs:field xpath="@code" />
    </xs:unique>
  </xs:element>

  <xs:complexType name="TypeStarTrek">
    <xs:sequence>
      <xs:element maxOccurs="12" minOccurs="12" name="Series" type="t:TypeSeries">
        <xs:unique name="uniqueSeasonNumber">
          <xs:selector xpath="t:Season" />
          <xs:field xpath="@number" />
        </xs:unique>
      </xs:element>
    </xs:sequence>
  </xs:complexType>

  <xs:complexType name="TypeSeries">
    <xs:sequence>
      <xs:element maxOccurs="7" minOccurs="1" name="Season" type="t:TypeSeason">
        <xs:unique name="uniqueEpisodeNumber">
          <xs:selector xpath="t:Episode" />
          <xs:field xpath="@number" />
        </xs:unique>
      </xs:element>
    </xs:sequence>

    <xs:attribute name="code" type="t:SeriesCode" use="required" />
    <xs:attribute name="name" type="t:StringNonEmpty" use="required" />
  </xs:complexType>

  <xs:complexType name="TypeSeason">
    <xs:sequence>
      <xs:element maxOccurs="30" minOccurs="0" name="Episode" type="t:TypeEpisode"></xs:element>
    </xs:sequence>
    <xs:attribute name="number" type="t:SeasonNumber" use="required" />
  </xs:complexType>

  <xs:complexType name="TypeEpisode">
    <xs:attribute name="number" type="t:EpisodeNumber" use="required" />
    <xs:attribute name="airdate" type="t:DateEmpty" use="required" />
    <xs:attribute name="name" type="t:StringNonEmpty" use="required" />
  </xs:complexType>

  <xs:simpleType name="StringNonEmpty">
    <xs:restriction base="xs:string">
      <xs:minLength value="1" />
    </xs:restriction>
  </xs:simpleType>

  <xs:simpleType name="DateEmpty">
    <xs:union memberTypes="t:Empty xs:date" />
  </xs:simpleType>

  <xs:simpleType name="EpisodeNumber">
    <xs:restriction base="xs:integer">
      <xs:minInclusive value="0" />
      <xs:maxInclusive value="30" />
    </xs:restriction>
  </xs:simpleType>

  <xs:simpleType name="SeasonNumber">
    <xs:restriction base="xs:integer">
      <xs:minInclusive value="1" />
      <xs:maxInclusive value="7" />
    </xs:restriction>
  </xs:simpleType>

  <xs:simpleType name="SeriesCode">
    <xs:restriction base="xs:string">
      <xs:enumeration value="TOS" />
      <xs:enumeration value="TAS" />
      <xs:enumeration value="TNG" />
      <xs:enumeration value="DS9" />
      <xs:enumeration value="VOY" />
      <xs:enumeration value="ENT" />
      <xs:enumeration value="DIS" />
      <xs:enumeration value="ST" />
      <xs:enumeration value="PIC" />
      <xs:enumeration value="LD" />
      <xs:enumeration value="PRO" />
      <xs:enumeration value="SNW" />
    </xs:restriction>
  </xs:simpleType>

  <xs:simpleType name="Empty">
    <xs:restriction base="xs:string">
      <xs:enumeration value="" />
    </xs:restriction>
  </xs:simpleType>

</xs:schema>
